{
	"$schema": "http://json-schema.org/draft-04/schema#",
	"type": "object",
	"required": [
		"dataset",
		"title",
		"description",
		"publisher",
		"superThemeTaxonomy"
	],
	"properties": {
		"publisher": {
			"type": "object",
			"required": ["name", "mbox"],
			"properties": {
				"name": { "$ref": "mixed-types.json#nonEmptyString" },
				"mbox": { 
					"type": "string",
			       		"format": "email"
				}
			}
		},
		"dataset": {
			"type": "array",
			"items": { "$ref": "dataset.json" }
		},
		"title": { "$ref": "mixed-types.json#nonEmptyString" },
		"description": { "$ref": "mixed-types.json#nonEmptyString" },
		"superThemeTaxonomy": { "$ref": "mixed-types.json#nonEmptyString" },
		"issued": { "$ref": "mixed-types.json#nonEmptyStringOrNull" },
		"modified": { "$ref": "mixed-types.json#nonEmptyStringOrNull" },
		"language": { "$ref": "mixed-types.json#arrayOrNull" },
		"themeTaxonomy": {
			"anyOf": [
				{ 
					"type": "array",
					"items": { "$ref": "theme.json" }
				},
				{ "type": "null" }
			]
	       	},
		"license": { "$ref": "mixed-types.json#nonEmptyStringOrNull" },
		"homepage": { "$ref": "mixed-types.json#nonEmptyStringOrNull" },
		"rights": { "$ref": "mixed-types.json#nonEmptyStringOrNull" },
		"spatial": {
			"anyOf": [
				{ "type": "string" },
				{ "type": "array" },
				{ "type": "null" }
			]
		}
	}
}
